
<portlet-definition
    xmlns="https://source.jasig.org/schemas/uportal/io/portlet-definition" 
    xmlns:xsi="http://www.w3.org/2001/XMLSchema-instance"
    xsi:schemaLocation="https://source.jasig.org/schemas/uportal/io/portlet-definition ../../../resources/xsd/io/portlet-definition/portlet-definition-4.0.xsd"
    script="classpath://org/jasig/portal/io/jaxb-import_v4-0.crn"
    version="4.0"
>

  <title>Please Register</title>
  <name>Please Register</name>
  <fname>please-register</fname>
  <desc>uPortal registration message.</desc>
  <type>CMS</type>
  <timeout>10000</timeout>
  <portlet-descriptor>
    <webAppName>/SimpleContentPortlet</webAppName>
    <portletName>cms</portletName>
  </portlet-descriptor>
  
  
  
  
    <category>Information</category>
  
  
    <group>Everyone</group>
  
  
    <parameter>
      <name>disableDynamicTitle</name>
      <value>true</value> 
    </parameter>
	<parameter>
      <name>iconUrl</name>
      <value>/ResourceServingWebapp/rs/tango/0.8.90/32x32/mimetypes/text-html.png</value>
    </parameter>
  
  
    <portlet-preference>
        <name>content</name>
        <value>
            <![CDATA[
                <h2>Please register</h2>
                
                <p>
                    Please <a href="http://www.jasig.org/uportal/deployments" 
                    target="_blank">list your deployment of uPortal alongside 
                    the many others already registered</a> so that the many 
                    people who have made uPortal possible can know that their 
                    code is working for you as well.
                </p>
            ]]>
        </value>
    </portlet-preference>
  
</portlet-definition>