
<portlet-definition
    xmlns="https://source.jasig.org/schemas/uportal/io/portlet-definition" 
    xmlns:xsi="http://www.w3.org/2001/XMLSchema-instance"
    xsi:schemaLocation="https://source.jasig.org/schemas/uportal/io/portlet-definition ../../../resources/xsd/io/portlet-definition/portlet-definition-4.0.xsd"
   
    version="4.0"
>

  <title>Who's Online</title>
  <name>Who's Online</name>
  <fname>whos-online</fname>
  <desc>Mockup of a Who's Online portlet.</desc>
  <type>CMS</type>
  <timeout>10000</timeout>
  <portlet-descriptor>
    <webAppName>/SimpleContentPortlet</webAppName>
    <portletName>cms</portletName>
  </portlet-descriptor>
  
  
  
  
    <category>Information</category>
  
  
    <group>Everyone</group>
  
  
    <parameter>
      <name>disableDynamicTitle</name>
      <value>true</value> 
    </parameter>
	<parameter>
      <name>iconUrl</name>
      <value>/ResourceServingWebapp/rs/tango/0.8.90/32x32/mimetypes/text-html.png</value>
    </parameter>
  
  
    <portlet-preference>
        <name>content</name>
        <value>
            <![CDATA[
                <img src="/uPortal/media/org/jasig/portal/channels/webproxy/whosonline.png" 
                alt="uP3 Mock My Courses" border="0" />
                
                <p>Mock of Who's Online.  This is a sample screen for 
                demonstration purposes only.</p>
                
            ]]>
        </value>
    </portlet-preference>
  
</portlet-definition>