
<portlet-definition
    xmlns="https://source.jasig.org/schemas/uportal/io/portlet-definition" 
    xmlns:xsi="http://www.w3.org/2001/XMLSchema-instance"
    xsi:schemaLocation="https://source.jasig.org/schemas/uportal/io/portlet-definition ../../../resources/xsd/io/portlet-definition/portlet-definition-4.0.xsd"
    script="classpath://org/jasig/portal/io/jaxb-import_v4-0.crn"
    version="4.0"
>

  <title>Password Management</title>
  <name>Password Management</name>
  <fname>passwordmgr</fname>
  <desc>Allows management of passwords.</desc>
  <type>Portlet</type>
  <timeout>50000</timeout>
  <portlet-descriptor>
    <isFramework>true</isFramework>
    <portletName>SelfEditAccount</portletName>
  </portlet-descriptor>
  
  
  
  
    <category>uPortal</category>
  
  
    <group>Faculty</group>
    <group>Staff</group>
    <group>Students</group>
  
  
	<parameter>
      <name>iconUrl</name>
      <value>/ResourceServingWebapp/rs/tango/0.8.90/32x32/categories/preferences-system.png</value>
    </parameter>
  
  
</portlet-definition>