
<portlet-definition
    xmlns="https://source.jasig.org/schemas/uportal/io/portlet-definition" 
    xmlns:xsi="http://www.w3.org/2001/XMLSchema-instance"
    xsi:schemaLocation="https://source.jasig.org/schemas/uportal/io/portlet-definition ../../../resources/xsd/io/portlet-definition/portlet-definition-4.0.xsd"
   
    version="4.0"
>

  <title>The Chronicle: Wired Campus</title>
  <name>The Chronicle: Wired Campus</name>
  <fname>chronicle-wired</fname>
  <desc>Top stories from The Chronicle of Higher Education: Wired Campus Edition</desc>
  <type>RSS</type>
  <timeout>5000</timeout>
  <portlet-descriptor>
    <webAppName>/NewsReaderPortlet</webAppName>
    <portletName>single-feed-news</portletName>
  </portlet-descriptor>
  
  
  
  
    <category>Entertainment</category>
    <category>News</category>
  
  
    <group>Everyone</group>
  
  
	<parameter>
      <name>iconUrl</name>
      <value>/ResourceServingWebapp/rs/tango/0.8.90/32x32/apps/internet-news-reader.png</value>
    </parameter>
    <parameter>
        <name>mobileIconUrl</name>
        <value>/uPortal/media/skins/icons/mobile/feed.png</value>
    </parameter>
    <parameter>
        <name>editable</name>
        <value>true</value>
    </parameter>
    <parameter>
        <name>hasHelp</name>
        <value>true</value>
    </parameter>
  
  
    <portlet-preference> 
      <name>name</name>
      <value>The Chronicle: Wired Campus</value>
    </portlet-preference>
    <portlet-preference> 
      <name>url</name>
      <value>http://chronicle.com/blog/Wired-Campus/5/rss</value>
    </portlet-preference>
    <portlet-preference> 
      <name>summaryView</name>
      <value>flyout</value>
    </portlet-preference>
  
</portlet-definition>